### ISSUE TITLE
TCP Connection via Messagepack contains multiple packets

### ISSUE THREAD

**Issue by maldag** [sgieseking/anyrpc#38]
[TCPResendMultiPing_Cut.txt](https://github.com/sgieseking/anyrpc/files/3569440/TCPResendMultiPing_Cut.txt)

We're using your anyrpc project to communicate to embedded devices. Assuring the devices are stilll alive we're sending a heartbeat to the device and wait for an answer. This occurs after waiting for 10ms (usually about around a second). Since we're having troubles with connection issues I recorded the TCP connection via `tcpdump` on linux and attached a filtered dump file.

In detail, we're sending the string `ping` to the device and are waiting for the string `pong`. This usually works, but sometimes the initial initiation of the connection is included in the actual payload. Sometimes this is messed up with multiple pings.

```
No.     Time           Source                Destination           Protocol Length Info
  52626 2327.495919    172.17.17.1           172.17.17.103         TCP      79     [TCP Retransmission] 52899 → 9000 [PSH, ACK] Seq=1298 Ack=23 Win=65536 Len=25

Frame 52626: 79 bytes on wire (632 bits), 79 bytes captured (632 bits)
Ethernet II, Src: FujitsuT_be:a8:d5 (90:1b:0e:be:a8:d5), Dst: Atmel_1f:ac:ca (fc:c2:3d:1f:ac:ca)
Internet Protocol Version 4, Src: 172.17.17.1, Dst: 172.17.17.103
Transmission Control Protocol, Src Port: 52899, Dst Port: 9000, Seq: 1298, Ack: 23, Len: 25
    Source Port: 52899
    Destination Port: 9000
    [Stream index: 1]
    [TCP Segment Len: 25]
    Sequence number: 1298    (relative sequence number)
    [Next sequence number: 1323    (relative sequence number)]
    Acknowledgment number: 23    (relative ack number)
    0101 .... = Header Length: 20 bytes (5)
    Flags: 0x018 (PSH, ACK)
    Window size value: 256
    [Calculated window size: 65536]
    [Window size scaling factor: 256]
    Checksum: 0xdce8 [unverified]
    [Checksum Status: Unverified]
    Urgent pointer: 0
    [SEQ/ACK analysis]
        [iRTT: 0.000329000 seconds]
        [Bytes in flight: 25]
        [Bytes sent since last PSH flag: 25]
        [TCP Analysis Flags]
            [Expert Info (Note/Sequence): This frame is a (suspected) retransmission]
            [The RTO for this segment was: 0.311942000 seconds]
            [RTO based on delta from frame: 52590]
    [Timestamps]
    TCP payload (25 bytes)
    Retransmitted TCP segment data (25 bytes)

0000  fc c2 3d 1f ac ca 90 1b 0e be a8 d5 08 00 45 00   ..=...........E.
0010  00 41 59 ea 40 00 80 06 26 42 ac 11 11 01 ac 11   .AY.@...&B......
0020  11 67 ce a3 23 28 ad 39 f5 a8 80 f9 35 23 50 18   .g..#(.9....5#P.
0030  01 00 dc e8 00 00 32 31 3a 93 02 a4 70 69 6e 67   ......21:...ping
0040  81 a1 23 82 a3 72 70 63 01 a3 63 6e 74 30 2c      ..#..rpc..cnt0,

[...]
No.     Time           Source                Destination           Protocol Length Info
  63651 2637.298319    172.17.17.1           172.17.17.103         TCP      101    [TCP Retransmission] 53000 → 9000 [PSH, ACK] Seq=3026 Ack=23 Win=65536 Len=47
0000  fc c2 3d 1f ac ca 90 1b 0e be a8 d5 08 00 45 00   ..=...........E.
0010  00 57 0c e2 40 00 80 06 73 34 ac 11 11 01 ac 11   .W..@...s4......
0020  11 67 cf 08 23 28 a0 b1 90 9b c5 c0 6b eb 50 18   .g..#(......k.P.
0030  01 00 49 8d 00 00 93 02 a4 70 69 6e 67 81 a1 23   ..I......ping..#
0040  82 a3 72 70 63 01 a3 63 6e 74 75 2c 32 31 3a 93   ..rpc..cntu,21:.
0050  02 a4 70 69 6e 67 81 a1 23 82 a3 72 70 63 01 a3   ..ping..#..rpc..
0060  63 6e 74 76 2c                                    cntv,

[...]
No.     Time           Source                Destination           Protocol Length Info
  72268 2724.402597    172.17.17.1           172.17.17.103         TCP      105    [TCP Retransmission] 53020 → 9000 [PSH, ACK] Seq=25610 Ack=23 Win=65536 Len=51
0000  fc c2 3d 1f ac ca 90 1b 0e be a8 d5 08 00 45 00   ..=...........E.
0010  00 5b 68 69 40 00 80 06 17 a9 ac 11 11 01 ac 11   .[hi@...........
0020  11 67 cf 1c 23 28 12 38 3e a8 27 93 71 f2 50 18   .g..#(.8>.'.q.P.
0030  01 00 a6 eb 00 00 93 02 a4 70 69 6e 67 81 a1 23   .........ping..#
0040  82 a3 72 70 63 01 a3 63 6e 74 cd 03 bf 2c 32 33   ..rpc..cnt...,23
0050  3a 93 02 a4 70 69 6e 67 81 a1 23 82 a3 72 70 63   :...ping..#..rpc
0060  01 a3 63 6e 74 cd 03 c0 2c                        ..cnt...,
```

Do you see any chance this might be caused in the anyrpc project? It looks like someone is not sending, but filling the send-buffer multiple times.

**Comment by sgieseking** [comment]
I normally investigate anyrpc issues by compiling with log4cplus and then enabling relevant items in the log4cplus.properties files on each side of the connection.  The output data can be directed to the terminal if you are starting manually or to a rolling set of files if you are starting automatically.

**Comment by sgieseking** [comment]
Has this issue been resolved?
